{
  "schema_version": "aigov-scope-manifest.v1",
  "scope_id": "aigov-scope.gov-adoption-ev4-decision-kernel-5ff5d7b-v2.batch-a",
  "plan_id": "GOV-ADOPTION-EV4-DECISION-KERNEL-5FF5D7B-V2",
  "batch_id": "BATCH_A",
  "repository": "rezahh107/EV4-Decision-Kernel",
  "base_branch": "main",
  "base_sha": "5ff5d7b20db11af36ab787eb8ac2d1127ea74644",
  "head_binding": "derived_at_runtime",
  "change_class": "L3",
  "scope_revision": "sha256:5a1e5697224446a01cb93d67f4a6fb02e7c18702d94b9dcd4f09ea710c638783",
  "committed": [
    ".github/workflows/validate-main.yml",
    ".github/workflows/validate-mvk.yml",
    "AGENTS.md",
    "README.md",
    "docs/governance/AIGOV_EXACT_MAIN_CLOSURE_PROTOCOL.md",
    "docs/governance/AIGOV_REVIEW_COMPATIBILITY_PROFILE.md",
    "docs/governance/BEHAVIORAL_RULE_COVERAGE.md",
    "kernel/decision-governance/aigov-repository-policy.v1.json",
    "kernel/fixtures/aigov/adversarial/coverage-self-promotion.json",
    "kernel/fixtures/aigov/adversarial/cross-turn-mutation.json",
    "kernel/fixtures/aigov/adversarial/deferred-item-deleted.json",
    "kernel/fixtures/aigov/adversarial/merge-before-review.json",
    "kernel/fixtures/aigov/adversarial/self-review.json",
    "kernel/fixtures/aigov/adversarial/stale-head.json",
    "kernel/fixtures/aigov/adversarial/stale-scope-revision.json",
    "kernel/fixtures/aigov/invalid/missing-required-carriers.json",
    "kernel/fixtures/aigov/invalid/security-and-budget-weakening.json",
    "kernel/fixtures/aigov/pr-inspector-v1.10.1/golden-green-review-package.json",
    "kernel/fixtures/aigov/valid/material-l3.json",
    "kernel/fixtures/aigov/valid/routine-l1-l2.json",
    "kernel/schemas/aigov-evidence-manifest.v1.schema.json",
    "kernel/schemas/aigov-ci-identity.v1.schema.json",
    "kernel/schemas/aigov-exact-main-receipt.v1.schema.json",
    "kernel/schemas/aigov-lifecycle-ledger.v1.schema.json",
    "kernel/schemas/aigov-repository-policy.v1.schema.json",
    "kernel/schemas/aigov-review-receipt.v1.schema.json",
    "kernel/schemas/aigov-scope-manifest.v1.schema.json",
    "kernel/validator/validate-aigov-governance.mjs",
    "kernel/validator/validate-coverage-guarantee.mjs",
    "kernel/vendor/pr-inspector/v1.10.1/decision-projection.schema.json",
    "kernel/vendor/pr-inspector/v1.10.1/review-package.schema.json",
    "package-lock.json",
    "package.json",
    "planning/NEXT_WORK.md",
    "planning/coverage/impacts/dcov-exec-001.pr49-aigov-v2-batch-a.json",
    "planning/decisions/AIGOV_ADOPTION_DECISION.md",
    "planning/governance/evidence/aigov-v2-batch-a.evidence.json",
    "planning/governance/scopes/aigov-v2-batch-a.scope.json",
    "planning/reviews/AIGOV_ADOPTION_AUDIT.md",
    "planning/reviews/AIGOV_ADOPT_000_POST_MERGE_RECONCILIATION.md",
    "planning/reviews/AIGOV_PR49_BOUNDED_REPAIR_TRIAGE.md",
    "planning/reviews/PRF-001_003_REPAIR_IMPLEMENTATION_HANDOFF.md",
    "tools/audit-behavioral-coverage.mjs",
    "tools/capture-aigov-ci-evidence.mjs",
    "tools/generate-aigov-scope-disclosure.mjs",
    "tools/lib/aigov-lifecycle.mjs",
    "tools/lib/aigov-ci-evidence.mjs",
    "tools/lib/pr-inspector-v1101.mjs",
    "tools/lib/aigov-test-fixtures.mjs",
    "tools/materialize-aigov-lifecycle.mjs",
    "tools/run-aigov-validation-suite.mjs",
    "tools/test-aigov-forbidden-operations.mjs",
    "tools/test-aigov-ci-identity.mjs",
    "tools/test-aigov-owner-evidence.mjs",
    "tools/test-aigov-provenance.mjs",
    "tools/test-aigov-sequence.mjs",
    "tools/validate-roadmap-memory-full.mjs",
    "tools/validate-roadmap-memory.mjs",
    "tools/verify-aigov-exact-main.mjs"
  ],
  "excluded": [
    "AIGOV-ADOPT-008 exact-main adoption closure",
    "BATCH_B recovery-program registration",
    "Coverage promotion or percentage calculation",
    "KROAD-012 through KROAD-018 product implementation",
    "external repository modification",
    "secret, permission, ruleset or branch-protection changes",
    "broad dependency upgrades; one exact yaml parser dependency is in scope for structural workflow parsing",
    "Merge or auto-merge"
  ],
  "deferred_not_deleted": [
    "AIGOV-ADOPT-008",
    "KROAD-012",
    "KROAD-013",
    "KROAD-014",
    "KROAD-015",
    "KROAD-016",
    "KROAD-017",
    "KROAD-018",
    "KROAD-012R historical record",
    "KREC-001 through KREC-009 registration",
    "external Coverage promotion"
  ],
  "dependencies": [
    "owner approval of GOV-ADOPTION-EV4-DECISION-KERNEL-5FF5D7B-V2",
    "exact base 5ff5d7b20db11af36ab787eb8ac2d1127ea74644",
    "existing Coverage fail-closed validator and fixtures",
    "external independent review on the final exact head",
    "owner-only Merge",
    "post-merge exact-main verification"
  ],
  "completion_evidence": [
    "exact-head CI for the final Batch A head",
    "executed exact-head evidence manifest meeting the L3 budget",
    "schema-valid exact-head lifecycle ledger through exact_head_validated bound to completed PR-head GitHub Actions run/job/check/artifact identity",
    "fresh independent review receipt bound to exact head and scope_revision",
    "repository-owner Merge metadata",
    "aigov-batch-a-exact-main-<sha>.json produced on current main",
    "full MVK, Coverage, roadmap, SSOT and AIGOV matrix Green on current main"
  ],
  "authorized_operations": [
    "create and update only the Batch A branch",
    "create at most one Draft Batch A PR",
    "bounded repair on the same PR",
    "run local and GitHub exact-head validation",
    "prepare independent-review handoff"
  ],
  "forbidden_changes": [
    "secret_change",
    "permission_change",
    "ruleset_change",
    "branch_protection_change",
    "force_push",
    "history_rewrite",
    "external_repository_write",
    "broad_dependency_upgrade",
    "destructive_deletion",
    "auto_merge",
    "agent_merge",
    "coverage_promotion",
    "product_implementation",
    "simultaneous_batch_b_pr"
  ]
}
