{
  "schema_version": "aigov-scope-manifest.v1",
  "scope_id": "aigov-scope.gov-adoption-ev4-decision-kernel-owner-policy-recovery-activation",
  "plan_id": "GOV-ADOPTION-EV4-DECISION-KERNEL-86E25A9-V4",
  "batch_id": "BATCH_B",
  "repository": "rezahh107/EV4-Decision-Kernel",
  "base_branch": "main",
  "base_sha": "435add8ee3f3274f781b6e391f11e3262e380c4e",
  "head_binding": "derived_at_runtime",
  "change_class": "L3",
  "scope_revision": "sha256:a5caa08cf1cebd1f661947793903c19a405e04c669c563334b434e4a747bc824",
  "committed": [
    ".github/workflows/finalize-aigov-batch-b.yml",
    ".github/workflows/validate-main.yml",
    ".github/workflows/validate-mvk.yml",
    ".github/workflows/validate-rereview-sequence.yml",
    "AGENTS.md",
    "README.md",
    "docs/decision-governance/COVERAGE_GUARANTEE_CONTRACT.md",
    "docs/governance/AIGOV_EXACT_MAIN_CLOSURE_PROTOCOL.md",
    "docs/governance/AIGOV_REVIEW_COMPATIBILITY_PROFILE.md",
    "kernel/decision-governance/aigov-repository-policy.v1.json",
    "kernel/decision-governance/coverage-guarantee-contract.v1.json",
    "kernel/fixtures/recovery-program/adversarial/coverage-credit.json",
    "kernel/fixtures/recovery-program/adversarial/coverage-promotion.json",
    "kernel/fixtures/recovery-program/adversarial/dependency-cycle.json",
    "kernel/fixtures/recovery-program/adversarial/kroad-012r-reactivation.json",
    "kernel/fixtures/recovery-program/adversarial/kroad-supersession.json",
    "kernel/fixtures/recovery-program/adversarial/product-effect.json",
    "kernel/fixtures/recovery-program/adversarial/readiness-overclaim.json",
    "kernel/fixtures/recovery-program/adversarial/self-dependency.json",
    "kernel/fixtures/recovery-program/invalid/activated-without-carrier.json",
    "kernel/fixtures/recovery-program/invalid/active-task-unauthorized.json",
    "kernel/fixtures/recovery-program/invalid/complete-with-incomplete-dependency.json",
    "kernel/fixtures/recovery-program/invalid/dependency-mutation.json",
    "kernel/fixtures/recovery-program/invalid/duplicate-task.json",
    "kernel/fixtures/recovery-program/invalid/extra-task.json",
    "kernel/fixtures/recovery-program/invalid/implemented-with-incomplete-dependency.json",
    "kernel/fixtures/recovery-program/invalid/missing-task.json",
    "kernel/fixtures/recovery-program/invalid/program-complete-incomplete-task.json",
    "kernel/fixtures/recovery-program/valid/full-program-activation.json",
    "kernel/fixtures/recovery-program/valid/parallel-branches.json",
    "kernel/fixtures/recovery-program/valid/registered-only.json",
    "kernel/schemas/aigov-repository-policy.v1.schema.json",
    "kernel/schemas/coverage-guarantee-contract.v1.schema.json",
    "kernel/schemas/recovery-execution-program.v1.schema.json",
    "kernel/validator/coverage-work-package-id.mjs",
    "kernel/validator/validate-coverage-guarantee-owner-policy.mjs",
    "kernel/validator/validate-recovery-execution-program.mjs",
    "package.json",
    "planning/KERNEL_EXECUTION_PLAN.md",
    "planning/KERNEL_EXECUTION_PLAN_KROAD_BASELINE.md",
    "planning/NEXT_WORK.md",
    "planning/coverage/impacts/dcov-recovery.pr51-owner-policy-activation.json",
    "planning/decisions/AIGOV_ADOPTION_DECISION.md",
    "planning/decisions/AIGOV_INDEPENDENT_REVIEW_POLICY_CHANGE.md",
    "planning/governance/scopes/aigov-owner-policy-recovery-activation.scope.json",
    "planning/recovery/recovery-execution-program.v1.json",
    "planning/reviews/AIGOV_ADOPTION_AUDIT.md",
    "planning/reviews/AIGOV_V4_BATCH_B_POST_MERGE_CLOSURE.md",
    "planning/reviews/RECOVERY_PROGRAM_ACTIVATION.md",
    "tools/generate-aigov-v3-batch-b-scope.mjs",
    "tools/lib/aigov-v3-closure.mjs",
    "tools/lib/pr-inspector-v1102.mjs",
    "tools/test-aigov-v3-exception.mjs",
    "tools/test-aigov-v4-hardening.mjs",
    "tools/test-coverage-impact-governance.mjs",
    "tools/test-recovery-program-lifecycle.mjs",
    "tools/validate-aigov-v4-governance.mjs",
    "tools/validate-roadmap-memory-v3.mjs",
    "tools/validate-roadmap-memory-v4-owner-policy.mjs",
    "tools/validate-roadmap-memory.mjs",
    "tools/verify-aigov-v3-exact-main.mjs"
  ],
  "excluded": [
    "substantive implementation of KREC-001 through KREC-009",
    "Coverage promotion, percentages or Coverage credit",
    "readiness or production-readiness claims",
    "KROAD supersession or KROAD-012R reactivation",
    "external repository modification",
    "secret, repository permission, Ruleset or branch-protection changes",
    "broad dependency upgrades",
    "deployment or release"
  ],
  "deferred_not_deleted": [
    "KREC-001 through KREC-009 substantive deliverables",
    "KROAD-012 product implementation",
    "KROAD-013 through KROAD-018",
    "external Coverage promotion and measurement activation"
  ],
  "dependencies": [
    "owner policy decision removing mandatory independent pre-Merge review",
    "merged PR #50 exact head e5c0c342d6417c8e85be54e7cb4caf372a116a35",
    "PR #50 merge commit 435add8ee3f3274f781b6e391f11e3262e380c4e",
    "PR #50 exact-head CI Green",
    "owner-only Merge authority",
    "preserved Recovery dependency graph"
  ],
  "completion_evidence": [
    "exact activation scope disclosure",
    "owner-policy AIGOV production tests",
    "dependency-aware Recovery lifecycle validation",
    "PR #50 method-aware Merge-result proof",
    "current-main Validate Main evidence",
    "exact-head activation PR CI Green",
    "owner-authorized activation PR Merge"
  ],
  "authorized_operations": [
    "update active repository policy and closure carriers",
    "record PR #50 closure under owner policy",
    "activate DCOV-COVERAGE-EXECUTION-PROGRAM",
    "authorize KREC-001 through KREC-009 without implementing deliverables",
    "create and Merge one focused activation PR after exact-head CI Green"
  ],
  "forbidden_changes": [
    "secret_change",
    "repository_permission_change",
    "ruleset_change",
    "branch_protection_change",
    "team_change",
    "bypass_actor_change",
    "force_push",
    "history_rewrite",
    "external_repository_write",
    "broad_dependency_upgrade",
    "destructive_deletion",
    "auto_merge",
    "coverage_promotion",
    "readiness_claim",
    "product_implementation",
    "krec_task_implementation",
    "kroad_supersession",
    "deployment",
    "release"
  ]
}
