{
  "schema_version": "aigov-scope-manifest.v1",
  "scope_id": "aigov-scope.gov-adoption-ev4-decision-kernel-86e25a9-v4.batch-b",
  "plan_id": "GOV-ADOPTION-EV4-DECISION-KERNEL-86E25A9-V4",
  "batch_id": "BATCH_B",
  "repository": "rezahh107/EV4-Decision-Kernel",
  "base_branch": "main",
  "base_sha": "86e25a9073df7e257ca7df799de85baf9b3fafb0",
  "head_binding": "derived_at_runtime",
  "change_class": "L3",
  "scope_revision": "sha256:d9e095a56170951a147fac582963c6fa7e21b2951ac810fcedffefe76ac6a1c0",
  "committed": [
    ".github/workflows/finalize-aigov-evidence.yml",
    ".github/workflows/validate-main.yml",
    ".github/workflows/validate-mvk.yml",
    ".github/workflows/validate-rereview-sequence.yml",
    "AGENTS.md",
    "README.md",
    "docs/governance/AIGOV_EXACT_MAIN_CLOSURE_PROTOCOL.md",
    "kernel/fixtures/recovery-program/adversarial/kroad-supersession.json",
    "kernel/fixtures/recovery-program/invalid/activated-without-carrier.json",
    "kernel/fixtures/recovery-program/valid/registered-only.json",
    "kernel/schemas/aigov-scope-manifest.v1.schema.json",
    "kernel/schemas/recovery-execution-program.v1.schema.json",
    "kernel/validator/validate-recovery-execution-program.mjs",
    "package.json",
    "planning/NEXT_WORK.md",
    "planning/coverage/impacts/dcov-exec-001.pr50-aigov-v3-batch-b.json",
    "planning/decisions/AIGOV_ADOPTION_DECISION.md",
    "planning/governance/scopes/aigov-v3-batch-b.scope.json",
    "planning/recovery/recovery-execution-program.v1.json",
    "planning/reviews/AIGOV_ADOPTION_AUDIT.md",
    "planning/reviews/AIGOV_BATCH_A_V3_POST_MERGE_RECONCILIATION.md",
    "planning/reviews/KROAD-012R_RECOVERY_SPEC_INTEGRATION_REVIEW.md",
    "tools/generate-aigov-v3-batch-b-scope.mjs",
    "tools/lib/aigov-v3-closure.mjs",
    "tools/materialize-pr-inspector-rereview-sequence.mjs",
    "tools/test-aigov-v3-exception.mjs",
    "tools/validate-roadmap-memory-v3.mjs",
    "tools/validate-roadmap-memory.mjs",
    "tools/verify-aigov-exact-main.mjs",
    "tools/verify-aigov-v3-exact-main.mjs"
  ],
  "excluded": [
    "Merge or auto-merge",
    "Coverage promotion or percentage calculation",
    "implementation of KREC-001 through KREC-009",
    "implementation of KROAD-012 through KROAD-018",
    "external repository modification",
    "secret, permission, ruleset or branch-protection changes",
    "broad dependency upgrades",
    "deployment or release"
  ],
  "deferred_not_deleted": [
    "independent PR-Inspector review on the final Batch B exact head and scope",
    "owner-only Merge",
    "post-Merge current-main validation",
    "KROAD-012 product implementation",
    "KROAD-013 through KROAD-018",
    "external Coverage promotion"
  ],
  "dependencies": [
    "owner approval of GOV-ADOPTION-EV4-DECISION-KERNEL-86E25A9-V4",
    "exact base 86e25a9073df7e257ca7df799de85baf9b3fafb0",
    "PR #49 exact tree equality between final head and squash commit",
    "merged PR #49 exact tuple and exact-head CI",
    "current-main Validate Main evidence",
    "external independent review on final Batch B head and scope_revision",
    "owner-only Merge"
  ],
  "completion_evidence": [
    "Batch A V4 exact-tree squash-equivalence report",
    "exact-head Batch B CI Green",
    "fresh independent PR-Inspector Green bound to final head and scope_revision",
    "owner Merge metadata",
    "method-aware deterministic Merge result proof on current main",
    "current-main AIGOV, roadmap, Coverage, recovery-program and MVK validation Green"
  ],
  "authorized_operations": [
    "update only governance/aigov-v3-batch-b-closure",
    "amend existing Draft PR #50 only",
    "bounded repair on the same PR",
    "run local and GitHub exact-head validation",
    "prepare independent-review handoff"
  ],
  "forbidden_changes": [
    "secret_change",
    "permission_change",
    "ruleset_change",
    "branch_protection_change",
    "force_push",
    "history_rewrite",
    "external_repository_write",
    "broad_dependency_upgrade",
    "destructive_deletion",
    "auto_merge",
    "agent_merge",
    "coverage_promotion",
    "product_implementation",
    "krec_task_implementation",
    "kroad_012_implementation",
    "deployment",
    "release"
  ]
}
